<!DOCTYPE compass-core-mapping PUBLIC
        "-//Compass/Compass Core Mapping DTD 1.0//EN"
        "http://www.opensymphony.com/compass/dtd/compass-core-mapping-1.0.dtd">

<compass-core-mapping package="org.compass.core.test.reference">

    <class name="A" alias="a">

        <id name="id"/>

        <property name="value">
            <meta-data>value</meta-data>
        </property>

        <reference name="b"/>

    </class>

    <class name="B" alias="b">

        <id name="id"/>

        <property name="value">
            <meta-data>value</meta-data>
        </property>

    </class>

    <class name="X" alias="x">

        <id name="id"/>

        <property name="value">
            <meta-data>value</meta-data>
        </property>

        <reference name="y" ref-alias="y"/>

    </class>

    <class name="Y" alias="y">

        <id name="id"/>

        <property name="value">
            <meta-data>value</meta-data>
        </property>

    </class>

    <class name="Cyclic1" alias="cyclic1">

        <id name="id"/>

        <property name="value">
            <meta-data>value</meta-data>
        </property>

        <reference name="cyclic2" ref-alias="cyclic2"/>

    </class>

    <class name="Cyclic2" alias="cyclic2">

        <id name="id"/>

        <property name="value">
            <meta-data>value</meta-data>
        </property>

        <reference name="cyclic1" ref-alias="cyclic1"/>

    </class>

    <class name="X" alias="x1">

        <id name="id"/>

        <property name="value">
            <meta-data>value</meta-data>
        </property>

        <reference name="y" ref-alias="y1" ref-comp-alias="y2"/>

    </class>

    <class name="Y" alias="y1">

        <id name="id"/>

        <property name="value">
            <meta-data>value</meta-data>
        </property>

    </class>

    <class name="Y" alias="y2" root="false">

        <property name="value">
            <meta-data>value1</meta-data>
        </property>

    </class>
</compass-core-mapping>
