<!DOCTYPE compass-core-mapping PUBLIC 
    "-//Compass/Compass Core Mapping DTD 1.0//EN"
    "http://www.opensymphony.com/compass/dtd/compass-core-mapping-1.0.dtd">

<compass-core-mapping package="org.compass.core.test.inheritance">

    <class name="BaseA" alias="base">
    
        <id name="id" />
        
        <property name="value">
            <meta-data>mvalue</meta-data>
        </property>
    
    </class>

    <class name="ExtendsA" alias="extends" extends="base">
    
        <property name="extendsValue">
            <meta-data>mextendsValue</meta-data>
        </property>
    
    </class>

    <class name="ExtendsA" alias="override" extends="base">

        <property name="value">
            <meta-data>mvalue1</meta-data>
        </property>
    
        <property name="extendsValue">
            <meta-data>mextendsValue</meta-data>
        </property>
    
    </class>

    <class name="ExtendsA" alias="override1" extends="base">

        <property name="value" override="false">
            <meta-data>mvalue1</meta-data>
        </property>
    
        <property name="extendsValue">
            <meta-data>mextendsValue</meta-data>
        </property>
    
    </class>
    
</compass-core-mapping>
